word,definition,example
contract,A binding agreement between two or more persons that is enforceable by law.,Marriage is a contract.
contradict,Be in contradiction with.,His testimony contradicts hers.
contradiction,Opposition between two conflicting forces or ideas.,His contradiction of the proposal was very interesting.
contradictory,Two propositions are contradictories if both cannot be true (or both cannot be false) at the same time.,
contrary,A relation of direct opposition.,we thought Sue was older than Bill but just the reverse was true
contrast,"The opposition or dissimilarity of things that are compared; ,.",in contrast to
contribute,Bestow a quality on.,Her presence lends a certain cachet to the company
contribution,The part played by a person in bringing about a result.,I am proud of my contribution in advancing the project
control,Power to direct or determine.,under control
controversial,Marked by or capable of arousing controversy.,the issue of the death penalty is highly controversial
controversy,A contentious speech act; a dispute where there is strong disagreement.,they were involved in a violent argument
convenience,The state of being suitable or opportune.,chairs arranged for his own convenience
convenient,Suited to your comfort or purpose or needs.,a convenient excuse for not going
conveniently,In a convenient manner.,the switch was conveniently located
convention,A large formal assembly.,political convention
conventional,Following accepted customs and proprieties.,conventional wisdom
conversation,The use of speech for informal exchange of views or ideas or information etc.,I had an interesting conversation with Nicolas yesterday about how much he's getting paid.
converse,A proposition obtained by conversion.,
conversely,With the terms of the relation reversed.,"conversely, not all women are mothers"
conversion,An event that results in a transformation.,His conversion to Christianity
convert,A person who has been converted to another religious or political belief.,They were all converts to Islam.
convey,"Make known; pass on, of information.",She conveyed the message to me
convince,"Make (someone) agree, understand, or realize the truth or validity of something.",He had finally convinced several customers of the advantages of his product
convinced,"Make (someone) agree, understand, or realize the truth or validity of something.",He had finally convinced several customers of the advantages of his product
cook,Someone who cooks food.,"I'm a terrible cook, so I eat a lot of frozen dinners."
cooker,A utensil for cooking.,
cookie,Any of various small flat sweet cakes (`biscuit' is the british term).,
cooking,The act of preparing something (as food) by the application of heat.,cooking can be a great art
cool,The quality of being at a refreshingly low temperature.,the cool of early morning
cooler,A refrigerator for cooling liquids.,Linen has made cool and breathable clothing for millennia.
cooperate,Work together on a common enterprise of project.,The soprano and the pianist did not get together very well
cooperation,Joint operation or action.,their cooperation with us was essential for the success of our mission
cooperative,A jointly owned commercial enterprise (usually organized by farmers or consumers) that produces and distributes goods and services and is run for the benefit of its owners.,"The patient was rarely cooperative, and tended to refuse treatment."
cop,Uncomplimentary terms for a policeman.,
cope,Brick that is laid sideways at the top of a wall.,"I thought I would never be able to cope with life after the amputation, but I have learned how to be happy again."
copper,A ductile malleable reddish-brown corrosion-resistant diamagnetic metallic element; occurs in various minerals but is the only metal that occurs abundantly in large masses; used as an electrical and thermal conductor.,
copy,A reproduction of a written record (e.g. of a legal or school record).,Please bring me the copies of those reports.
copyright,A document granting exclusive right to publish and sell literary or musical or artistic work.,Copyright is a separate legal area from trademarks.
coral,A variable color averaging a deep pink.,
core,A small group of indispensable persons or things.,five periodicals make up the core of their publishing program
corn,Tall annual cereal grass bearing kernels on large ears: widely cultivated in america in many varieties; the principal cereal in mexico and central and south america since pre-columbian times.,He paid her the nominal fee of two corns of barley.
corner,A place off to the side of an area.,he tripled to the rightfield corner
cornerstone,The fundamental assumptions from which something is begun or developed or calculated or explained.,the whole argument rested on a basis of conjecture
cornet,A brass musical instrument with a brilliant tone; has a narrow tube and a flared bell and is played by means of valves.,
corona,The outermost region of the sun's atmosphere; visible as a white halo during a solar eclipse.,
corporal,A noncommissioned officer in the army or air force or marines.,corporal punishment
corporate,Of or belonging to a corporation.,corporate rates
corporation,A business firm whose articles of incorporation have been approved in some state.,
correct,Make right or correct.,Correct the mistakes
correction,The act of offering an improvement to replace a mistake; setting right.,"I have four T-80 tanks at grid Three-niner-niner-four-eight-eight, Correction: Grid Three niner-niner-four-eight-five. How copy? Over."
correctly,In an accurate manner.,the flower had been correctly depicted by his son
correctness,Conformity to fact or truth.,
correspond,"Be compatible, similar or consistent; coincide in their characteristics.",The two stories don't agree in many details
correspondence,Communication by the exchange of letters.,
correspondent,Someone who communicates by means of letters.,
corresponding,"Be compatible, similar or consistent; coincide in their characteristics.",The two stories don't agree in many details
corridor,An enclosed passageway; rooms usually open onto it.,
corrupt,Corrupt morally or by intemperance or sensuality.,debauch the young people with wine and women
corruption,Lack of integrity or honesty (especially susceptibility to bribery); use of a position of trust for dishonest gain.,a corruption of style
cost,The total spent for goods or services including money and time and labor.,It will cost you a lot of money to take a trip around the world.
costly,Entailing great loss or sacrifice.,a dearly-won victory
costume,The attire worn in a play or at a fancy dress ball.,he won the prize for best costume
cottage,A small house with a single story.,Most cottages in the area were larger and more elaborate than my home.
cotton,Soft silky fibers from cotton plants in their raw state.,
couch,An upholstered seat for more than one person.,
cough,A sudden noisy expulsion of air from the lungs that clears the air passages; a common symptom of upper respiratory infection or bronchitis or pneumonia or tuberculosis.,"Behind me, I heard a distinct, dry cough."
could,"(auxiliary verb, defective) To know how to; to be able to.","She can speak English, French, and German.   I can play football.   Can you remember your fifth birthday?"
council,A body serving in an administrative capacity.,student council
counseling/counselling,Something that provides direction or advice as to a decision or course of action.,"Psychiatrists, psychologists, social workers and other mental health professionals counsel clients."
count,The total number counted.,a blood count
counter,Table consisting of a horizontal surface over which business is transacted.,"He's only 16 months, but is already a good counter – he can count to 100."
countless,Too numerous to be counted.,incalculable riches
country,A politically organized body of people under a single government.,the state has elected a new president
countryman,A man from your own country.,
countryside,Rural regions.,We live in the Swedish countryside.
countrywide,Occurring or extending throughout a country or nation.,the event aroused nationwide interest
county,(united kingdom) a region created by territorial division for the purpose of local government.,"the county has a population of 12,345 people"
couple,A pair who associate with one another.,the engaged couple
courage,A quality of spirit that enables you to face danger or pain without showing fear.,It takes a lot of courage to be successful in business.
courageous,Possessing or displaying courage; able to face and deal with danger or fear without flinching; - herman melville; - william wordsworth.,Familiarity with danger makes a brave man braver but less daring
courgette,Marrow squash plant whose fruit are eaten when small.,
course,Education imparted in a series of lessons or meetings.,he took a course in basket weaving
court,An assembly (including one or more judges) to conduct judicial business.,The girls were playing in the court.
courtesy,A courteous or respectful or considerate act.,"He was always known for his grace, kindness, and courtesy to people of every rank."
cousin,The child of your aunt or uncle.,I think my cousin is a good man.
cover,A covering that serves to conceal or shelter something.,a screen of trees afforded privacy
cow,Female of domestic cattle:.,`moo-cow' is a child's term
coward,A person who shows fear or timidity.,
cowardly,Lacking courage; ignobly timid and faint-hearted; - p.b.shelley.,"cowardly dogs, ye will not aid me then"
coziness/cosiness,A state of warm snug comfort.,
cozy/cosy,A padded cloth covering to keep a teapot warm.,"He spent all day cosying up to the new boss, hoping for a plum assignment."
crab,Decapod having eyes on short stalks and a broad flattened carapace with a small abdomen folded under the thorax and pincers.,"Although crabs themselves are an easily treated inconvenience, the patient and his partner(s) clearly run major STD risks."
crack,A long narrow opening.,A large crack had formed in the roadway.
craft,The skilled practice of a practical occupation.,he learned his trade as an apprentice
craftsman,A professional whose work is consistently of high quality.,as an actor he was a consummate craftsman
crash,A loud resonant repeating noise.,he could hear the clang of distant bells
crater,A bowl-shaped geological formation at the top of a volcano.,He cratered into that snow bank about five seconds after his first lesson.
crawl,A very slow movement.,the traffic advanced at a crawl
crazy,Someone deranged and possibly dangerous.,His ideas were both frightening and crazy.
cream,The best people or things in a group.,the cream of England's young men were killed in the Great War
crease,An angular or rounded shape made by folding.,a fold in the napkin
create,Make or cause to be or to become.,make a mess in one's office
creation,The human act of creating.,I think the manufacturer was so ashamed of its creation that it didn't put its name on it!
creative,Having the ability or power to create.,a creative imagination
creatively,In a creative manner.,she solved the problem creatively
creativity,The ability to create.,His creativity is unsurpassed by his fellow students in the art class.
creator,Terms referring to the judeo-christian god.,Kenneth E. Iverson was the creator of APL.
creature,A living organism characterized by voluntary movement.,He's a creature of habit.   insects and other creatures
credit,Approval.,give her recognition for trying
credit card,"A plastic card, usually with a magnetic strip or an embedded microchip, connected to a credit account and used to buy goods or services.",
creek,A natural stream of water smaller than a river (and often a tributary of a river).,the creek dried up every summer
creepy,Annoying and unpleasant.,some creepy kids were bothering her
crew,"The men and women who man a vehicle (ship, aircraft, etc.).",He’s been crowing all day about winning the game of cards.
cricket,Leaping insect; male makes chirping noises by rubbing the forewings together.,
crime,(criminal law) an act punishable by law; usually considered an evil act.,a long record of crimes
criminal,Someone who has committed a crime or has been legally convicted of a crime.,His long criminal record suggests that he is a dangerous man.
cripple,Someone who is unable to walk normally because of an injury or disability to the legs or back.,He returned from war a cripple.
crisis,An unstable situation of extreme danger or difficulty.,they went bankrupt during the economic crisis
crisp,A thin crisp slice of potato fried in deep fat.,kale crisps
critic,A person who is professionally engaged in the analysis and interpretation of works of art.,"Bob liked most of my presentation, but offered three minor critiques."
critical,Marked by a tendency to find and call attention to errors and flaws.,a critical attitude
critically,In a critical manner.,this must be examined critically
criticism,Disapproval expressed by pointing out faults or shortcomings.,the senator received severe criticism from his opponent
criticize/criticise,Find fault with; express criticism of; point out real or perceived flaws.,The paper criticized the new movie
crocodile,Large voracious aquatic reptile having a long snout with massive jaws and sharp teeth and a body covered with bony plates; of sluggish tropical waters.,
crop,The yield from plants in a single growing season.,the farmer had lots of crops to sell at the market
cross,A wooden structure consisting of an upright post with a transverse piece.,Put a cross for a wrong answer and a tick for a right one.
crossing,Traveling across.,They managed to cross a sheep with a goat.
crossly,In an ill-natured manner.,she looked at her husband crossly
crossroads,A community of people smaller than a village.,
crow,Black birds having a raucous call.,
crowd,A large number of things or people considered together.,a crowd of insects assembled around the flowers
crowded,"Cause to herd, drive, or crowd together.",We herded the children into a spare classroom
crown,The crown (or the reigning monarch) as the symbol of the power and authority of a monarchy.,the colonies revolted against the Crown
crucial,Of extreme importance; vital to the resolution of a crisis.,a crucial moment in his career
cruel,(of persons or their actions) able or disposed to inflict pain or suffering.,a barbarous crime
cruelly,Excessively.,a cruelly bitter winter
cruelty,A cruel act; a deliberate infliction of pain and suffering.,
cruise,An ocean trip taken for pleasure.,Germany cruised to a World Cup victory over the short-handed Australians.
crush,Leather that has had its grain pattern accentuated.,a crush at a reception
cry,A loud utterance; often in protest or opposition.,the speaker was interrupted by loud cries from the rear of the audience
crystallize/crystallise,Cause to take on a definite and clear shape.,He tried to crystallize his thoughts
cube,A hexahedron with six equal squares as faces.,a stock cube
cubism,An artistic movement in france beginning in 1907 that featured surfaces of geometrical planes.,
cucumber,A melon vine of the genus cucumis; cultivated from earliest times for its cylindrical green fruit.,
cuff,The lap consisting of a turned-back hem encircling the end of the sleeve or leg.,
culmination,A final climactic stage.,their achievements stand as a culmination of centuries of development
cultivate,Foster the growth of.,Most farmers in this region cultivate maize.
cultural,Of or relating to the arts and manners that a group favors.,cultural events
culturally,With regard to a culture.,culturally integrated
culture,A particular society at a particular time and place.,early Mayan civilization
cup,A small open container usually used for drinking; usually has a handle.,he put the cup back in the saucer
cupboard,A small room (or recess) or cabinet used for storage space.,Put the cups back into the cupboard.
cure,A medicine or therapy that cures disease or relieve pain.,
curiosity,A state in which you want to learn more about something.,He put the strangely shaped rock in his curiosity cabinet.
curious,Beyond or deviating from the usual or expected.,a curious hybrid accent
curiously,In a manner differing from the usual or expected.,had a curiously husky voice
curl,A round shape formed by a series of concentric circles (as formed by leaves or flower petals).,"The curl of the vector field \vec{F}(x,y,z) is the vector field \operatorname{curl}\,\vec{F} \equiv \vec{\nabla}\times\vec{F}=\left( \frac{\partial F_z}{\partial y} - \frac{\partial F_y}{\partial z}, \frac{\partial F_x}{\partial z} - \frac{\partial F_z}{\partial x}, \frac{\partial F_y}{\partial x} - \frac{\partial F_x}{\partial y} \right)."
curly,(of hair) having curls or waves.,they envied her naturally curly hair
currency,The metal or paper medium of exchange that is presently used.,Wampum was used as a currency by Amerindians.
current,A flow of electricity through a conductor.,the current was measured in amperes
currently,At this time or period; now.,he is presently our ambassador to the United Nations
curriculum,An integrated course of academic studies.,he was admitted to a new program at the university
curry,(east indian cookery) a pungent dish of vegetables or meats flavored with curry powder and usually eaten with rice.,
curse,Profane or obscene expression usually of surprise or anger.,expletives were deleted
cursor,(computer science) indicator consisting of a movable spot of light (an icon) on a visual display; moving it allows the user to point to commands or screen positions.,
curtain,Hanging cloth used as a blind (especially for a window).,He took so long to shave his head that we arrived 45 minutes after curtain and were denied late entry.
curve,The trace of a point whose direction of motion changes.,You should slow down when approaching a curve.
cushion,A mechanical damper; absorbs energy of sudden impulses.,the old car needed a new set of shocks
custom,Accepted or habitual practice.,The Ancient Egyptian culture had many distinctive and interesting beliefs and customs.
customer,Someone who pays for goods or services.,Every person who passes by is a potential customer.
customs,Money collected under a tariff.,Customs of £200 were due on all the wine we took back from France.
cut,A share of the profits.,everyone got a cut of the earnings
cute,Attractive especially by means of smallness or prettiness or quaintness.,a cute kid with pigtails
CV,A summary of your academic and work history.,
cyberaddict,,
cybercafe/cybercafé,A cafe whose customers sit at computer terminals and log on to the internet while they eat and drink.,
cybercrime,Crime committed using a computer and the internet to steal a person's identity or sell contraband or stalk victims or disrupt operations with malevolent programs.,
cyberpet,,
cyberschool,,
cyberspace,A computer network consisting of a worldwide network of computer networks that use the tcp/ip network protocols to facilitate data transmission and exchange.,
cycle,An interval during which a recurring sequence of events occurs.,the never-ending cycle of the seasons
cycling,The sport of traveling on a bicycle or motorcycle.,Avoid cycling the device unnecessarily.
cyclist,A person who rides a bicycle.,
dad,An informal term for a father; probably derived from baby talk.,His dad was always there for him.
daddy,An informal term for a father; probably derived from baby talk.,"Rock 'n' roll is cool, daddy, and you know it!"
daft,Informal or slang terms for mentally irregular.,it used to drive my husband balmy
daily,A newspaper that is published every day.,
daisy,Any of numerous composite plants having flower heads with well-developed ray flowers usually arranged in a single whorl.,
dam,A barrier constructed to contain the flow of water or to keep out the sea.,A dam is often an essential source of water to farmers of hilly country.
damage,The occurrence of a change for the worse.,The storm did a lot of damage to the area.
damaged,Inflict damage upon.,The snow damaged the roof
damn,Something of little value.,his promise is not worth a damn
damp,A slight wetness.,to damp cloth
dance,An artistic form of nonverbal communication.,So how much longer are we gonna do this dance?
dancer,A performer who dances professionally.,
dancing,Taking a series of rhythmical steps (and movements) in time to music.,I danced with her all night long.
dandelion,Any of several herbs of the genus taraxacum having long tap roots and deeply notched leaves and bright yellow flowers followed by fluffy seed balls.,
danger,The condition of being susceptible to harm or injury.,you are in no danger
dangerous,Involving or causing danger or risk; liable to hurt or harm.,a dangerous criminal
dangerously,In a dangerous manner.,he came dangerously close to falling off the ledge
dare,A challenge to do something dangerous or foolhardy.,he could never refuse a dare
dark,Absence of light or illumination.,The room was too dark for reading.
darkness,Absence of light or illumination.,The darkness of the room made it difficult to see.
darling,A special loved one.,"Mary, the youngest daughter, was always her mother's darling."
dash,Distinctive and stylish elegance.,he wooed her with the confident dash of a cavalry officer
data,A collection of facts from which conclusions may be drawn.,statistical data
database,An organized body of related information.,I have a database of all my contacts in my personal organizer.
date,The specified day of the month.,what is the date today?
dated,Go on a date with.,Tonight she is dating a former high school sweetheart
dating,Use of chemical analysis to estimate the age of geological specimens.,"to date a letter, a bond, a deed, or a charter"
daughter,A female human offspring.,her daughter cared for her in her old age
daughter-in-law,The wife of your son.,
dawn,The first light of day.,we got up before dawn
day,Time for earth to make a complete rotation on its axis.,two days later they left
daylight,The time after sunrise and before sunset while it is light outside.,the dawn turned night into day
daytime,The time after sunrise and before sunset while it is light outside.,the dawn turned night into day
daze,The feeling of distress and disbelief that you have when something bad happens accidentally.,his mother's death left him in a daze
dazzle,Brightness enough to blind partially and temporarily.,"Dazzled by the headlights of the lorry, the deer stopped in the middle of the street."
de facto,"A legally undeclared spouse; a partner in a spousal relationship which is not officially declared as a marriage, comparable to a common law husband or wife.","Although the United States currently has no official language, it is largely monolingual with English being the de facto national language."
dead,People who are no longer living.,they buried the dead
deadline,The point in time at which something must be completed.,I must make this deadline or my boss will kill me!
deadly,Causing or capable of causing death.,a fatal accident
deaf,People who have severe hearing impairments.,many of the deaf use sign language
deal,A particular instance of buying or selling.,it was a package deal
dealer,Someone who purchases and maintains an inventory of goods to be sold.,That used car dealer gave me a great deal on my 1962 rusted-out Volkswagen bug!
dear,A beloved person; used as terms of endearment.,"My cousin is such a dear, always drawing me pictures."
dearly,In a sincere and heartfelt manner.,I would dearly love to know
death,The event of dying or departure from life.,her death came as a terrible shock
debate,A discussion in which reasons are advanced for and against some proposition or proposal.,the argument over foreign aid goes on and on
debit,An accounting entry acknowledging sums that are owing.,A cash sale is recorded as debit on the cash account and as credit on the sales account.
debit card,"A card much like a credit card, but which takes money directly from the bank account, rather than borrowing the money from the issuer of the card.",
debris,The remains of something that has been destroyed or broken up.,
debt,The state of owing something (especially money).,he is badly in debt
decade,A period of 10 years.,a decade of soldiers
decay,The process of gradually becoming inferior.,The pair loved to take pictures in the decaying hospital on forty-third street.
deceive,Be false to; be dishonest with.,
December,The last (12th) month of the year.,
decent,Socially or conventionally correct; refined or virtuous.,from a decent family
deceptive,Causing one to believe what is not true or fail to believe what is true.,deceptive calm
decide,"Reach, make, or come to a decision about something.",We finally decided after lengthy deliberations
decision,The act of making up your mind about something.,the burden of decision was his
decisive,Determining or having the power to determine an outcome.,cast the decisive vote
deck,Any of various platforms built into a vessel.,to swab the deck
declaration,A statement that is emphatic and explicit (spoken or written).,
declare,State emphatically and authoritatively.,He declared that he needed more money to carry out the task he was charged with
decline,Change toward something smaller or lower.,The dollar has declined rapidly since 2001.
decomposition,The analysis of a vector field.,
decorate,"Make more attractive by adding ornament, colour, etc.",Decorate the room for the party
decoration,Something used to beautify.,
decorative,Serving an esthetic rather than a useful purpose.,cosmetic fenders on cars
decrease,A change downward.,there was a decrease in his temperature as the fever subsided
dedicate,"Give entirely to a specific person, activity, or cause.",She committed herself to the work of God
dedication,Complete and wholehearted fidelity.,
deduce,Reason by deduction; establish by deduction.,to deduce a part from the whole
