word,definition,example
genetic,Occurring among members of a family usually by heredity.,an inherited disease
genetically,By genetic mechanisms.,genetically passed down talents
genetics,The branch of biology that studies heredity and variation in organisms.,
genius,Someone who has exceptional intellectual ability and originality.,Mozart was a child genius
genre,A kind of literary or artistic work.,The computer game Half-Life redefined the first-person shooter genre.
gentle,Cause to be more favorably inclined; gain the good will of.,She managed to mollify the angry customer
gentleman,A man of refinement.,"Being a gentleman, Robert was entitled to shove other commoners into the gongpit but he still had to jump out of the way of the knights to avoid the same fate himself."
gently,In a gradual manner.,a gently sloping terrain
genuine,Not fake or counterfeit.,a genuine Picasso
genuinely,In accordance with truth or fact or reality.,she was now truly American
geographic,Of or relating to the science of geography.,
geographical,Of or relating to the science of geography.,
geography,Study of the earth's surface; includes people's responses to topography and climate and soil and vegetation.,
geology,A science that deals with the history of the earth as recorded in rocks.,The geology of the Alps.
germ,Anything that provides inspiration for later work.,the germ of civil liberty
gesture,Motion of hands or body to emphasize or help to express a thought or feeling.,The middle-finger gesture is really a nonverbal swear.
get,A return on a shot that seemed impossible to reach and would normally have resulted in a point for the opponent.,I'm going to get a computer tomorrow from the discount store.
getaway,The attribute of being capable of rapid acceleration.,his car has a lot of pickup
ghetto,Formerly the restricted quarter of many european cities in which jews were required to live.,the Warsaw ghetto
ghost,A mental representation of some haunting experience.,he looked like he had seen a ghost
giant,Any creature of exceptional size.,The retail giant is set to acquire two more struggling high-street chains.
gift,Something acquired without compensation.,She had a gift for playing the flute.
gifted,Give qualities or abilities to.,a gifted artist
giggle,A foolish or nervous laugh.,The women thought it would be quite a giggle to have a strippergram at the bride's hen party.
ginger,Perennial plants having thick branching aromatic rhizomes and leafy reedlike stems.,
giraffe,Tallest living quadruped; having a spotted coat and small horns and very long neck and legs; of savannahs of tropical africa.,Are you having a giraffe?!
girl,A young woman.,a young lady of 18
girlfriend,Any female friend.,Mary and her girlfriend organized the party
give,The elasticity of something that can be stretched and returns to its original length.,There is no give in his dogmatic religious beliefs.
giveaway,A gift of public land or resources for the private gain of a limited group.,The T-shirt was a giveaway from the company that sells the software.
given,An assumption that is taken for granted.,I give it a 95% chance of success.
glacis,A gentle incline in front of a fortification.,
glad,Any of numerous plants of the genus gladiolus native chiefly to tropical and south africa having sword-shaped leaves and one-sided spikes of brightly colored funnel-shaped flowers; widely cultivated.,I'm glad the rain has finally stopped.
glamorous/glamourous,"Having an air of allure, romance and excitement.",glamorous movie stars
glance,A quick look.,copper glance
glare,A light within the field of vision that is brighter than the brightness to which the eyes are adapted.,a glare of sunlight
glass,A brittle transparent solid with irregular atomic structure.,to fibreglass the hull of a fishing-boat
glasses,Optical instrument consisting of a frame that holds a pair of lenses for correcting defective vision.,to fibreglass the hull of a fishing-boat
gleam,An appearance of reflected light.,The rescue workers preserved a gleam of optimism that they might still survive.
glee,Great merriment.,
glide,A vowellike sound that serves as a consonant.,
glimpse,A quick look.,"I only got a glimpse of the car, so I can tell you the colour but not the registration number."
glint,A momentary flash of light.,I saw the glint of metal as he raised the gun.
global,Involving the entire earth; not limited or provincial in scope.,global war
global warming,"A sustained increase in the average temperature of the Earth, sufficient to cause climate change.",
globally,Throughout the world.,this is globally significant
globe,The 3rd planet from the sun; the planet we live on.,the Earth moves around the sun
glocal,Being both global and local.,
gloomy,Depressingly dark.,the gloomy forest
glorify,"Praise, glorify, or honor.",extol the virtues of one's children
glorious,Having or deserving or conferring glory.,a long and glorious career
glory,A state of high honor.,he valued glory above life itself
glove,The handwear used by fielders in playing baseball.,I wore gloves to keep my hands warm.
glow,An alert and refreshed state.,He had a bright red glow on his face.
go,A time for working (after which you will be relieved by someone else).,it's my go
goal,The state of affairs that a plan is intended to achieve and that (when achieved) terminates behavior intended to achieve it.,the ends justify the means
goalkeeper,The soccer or hockey player assigned to protect the goal.,
goat,Any of numerous agile ruminants related to sheep but having a beard and straight horns.,
god,The supernatural being conceived as the perfect and omnipotent and omniscient originator and ruler of the universe; the object of worship in monotheistic religions.,"Dawn believes in God, but Willow believes in multiple gods and goddesses."
goddess,A female deity.,
godly,Showing great reverence for god.,a godly man
gold,Coins made of gold.,France has won three golds and five silvers.
golden,Having the deep slightly brownish color of gold.,long aureate (or golden) hair
golf,A game played on a large open course with 9 or 18 holes; the object is use as few strokes as possible in playing all the holes.,
golfer,Someone who plays the game of golf.,
good,Benefit.,for your own good
good afternoon,,
good morning,"An exercise performed by bending forward at the waist and then returning to a standing posture, while bearing a barbell across the shoulders.","""Good morning, Joan,"" said Judy at 9:00 AM."
good night,,
good-looking,Pleasing in appearance especially by reason of conformity to ideals of form and proportion; ; ; ; - thackeray; - lillian hellman.,a fine-looking woman
goodness,That which is pleasing or valuable or useful.,weigh the good against the bad
goods,Benefit.,for your own good
goodwill,(accounting) an intangible asset valued according to the advantage or reputation a business has acquired (over and above its tangible assets).,
gook,"Any thick, viscous matter.",
gorge,A deep ravine (usually with a river running through it).,
gorgeous,Dazzlingly beautiful.,a gorgeous Victorian gown
gorilla,Largest anthropoid ape; terrestrial and vegetarian; of forests of central west africa.,
gossip,Light informal conversation for social occasions.,Be careful what you say to him: he’s a bit of a gossip.
govern,Bring into conformity with rules or principles or usage; impose regulations.,We cannot regulate the way people dress
government,The organization that is the governing authority of a political unit.,the government reduced taxes
governmental,Relating to or dealing with the affairs or structure of government or politics or the state.,governmental policy
governor,The head of a state government.,
gown,"A woman's dress, usually with a close-fitting bodice and a long flared skirt, often worn on formal occasions.","In the perennial town versus gown battles, townies win some violent battles, but the collegians are winning the war."
grab,A mechanical device for gripping an object.,I grabbed her hand to pull her back from the cliff edge.
grace,(christian theology) a state of sanctification by god; the state of one who is under such divine influence.,the conception of grace developed alongside the conception of sin
graceful,"Characterized by beauty of movement, style, form, or execution.",She is a graceful dancer.
gracefulness,Beautiful carriage.,
grade,A body of students who are taught together.,early morning classes are always sleepy
gradual,(roman catholic church) an antiphon (usually from the book of psalms) immediately after the epistle at mass.,a gradual increase of knowledge; a gradual decline
gradually,In a gradual manner.,the snake moved gradually toward its victim
graduate,A person who has received a degree from a school (high school or college or university).,If the government wants graduates to stay in the country they should offer more incentives.
graduation,The successful completion of a program of study.,
grain,A relatively small granular particle of a substance.,a grain of sand
gram/gramme,A metric unit of weight equal to one thousandth of a kilogram.,
grammar,The branch of linguistics that deals with syntax and morphology (and sometimes also deals with semantics).,a grammar of geography
grand,The cardinal number that is the product of 10 and 100.,a grand army
grandchild,A child of your son or daughter.,
granddad,The father of your father or mother.,"Hey! Get out of my way, granddad!"
granddaughter,A female grandchild.,
grandfather,The father of your father or mother.,
grandma,The mother of your father or mother.,
grandmother,The mother of your father or mother.,
grandpa,The father of your father or mother.,
grandparent,A parent of your father or mother.,
grandson,A male grandchild.,
granny,The mother of your father or mother.,I'm going to be a granny.
grant,Any monetary aid.,I got a grant from the government to study archeology in Egypt.
grape,Any of various juicy fruit of the genus vitis with green or purple skins; grow in clusters.,
graph,A visual representation of the relations between certain quantities plotted with reference to a set of axes.,
graphic,An image that is generated by a computer.,I've just played this new computer game: the graphics are amazing.
graphically,In a diagrammatic manner.,"the landscape unit drawn diagrammatically illustrates the gentle rolling relief, with a peat-filled basin"
graphics,Photographs or other visual representations in a printed publication.,the publisher was responsible for all the artwork in the book
grasp,Understanding of the nature or meaning or quality or magnitude of something.,he has a good grasp of accounting practices
grass,Narrow-leaved green herbage: grown as lawns; used as pasture for grazing animals; cut and dried as hay.,What just happened must remain secret. Don't be a 'grass.
grateful,Feeling or showing gratitude.,a grateful heart
gratitude,A feeling of thankfulness and appreciation.,he was overwhelmed with gratitude for their help
grave,Death of a person.,he went to his grave without forgiving me
gravestone,A stone that is used to mark a grave.,
gravitation,(physics) the force of attraction between all masses in the universe; especially the attraction of the earth's mass for bodies near its surface; ; ; --albert einstein.,the more remote the body the less the gravity
gravy,"A sauce made by adding stock, flour, or other ingredients to the juice and fat that drips from cooking meats.",The first thousand tickets and the concessions cover the venue and the band. The rest is gravy.
gray/grey,A neutral achromatic color midway between white and black.,My hair is beginning to gray.
great,A person who has achieved distinction and honor in some field.,he is one of the greats of American music
greatly,To an extraordinary extent or degree.,he improved greatly
greatness,The property possessed by something or someone of outstanding importance or eminence.,"Due to the greatness of his size, he was an effective bodyguard."
greedy,Immoderately desirous of acquiring e.g. wealth.,they are avaricious and will do anything for money
green,Green color or pigment; resembling the color of growing grass.,The former flag of Libya is fully green.
greenhouse,A building with glass walls and roof; for the cultivation and exhibition of plants under controlled conditions.,
greet,Express greetings upon meeting someone.,A brilliant dawn greeted her eyes as she looked out of the window.
greeting,(usually plural) an acknowledgment or expression of good will (especially on meeting).,A brilliant dawn greeted her eyes as she looked out of the window.
grief,Intense sorrow caused by loss of a loved one (especially by death).,She was worn out from so much grief.
grieve,Feel grief.,to grieve one's fate
grill,A restaurant where food is cooked on a grill.,I put some peppers and mushrooms on the grill to go with dinner.
grilled,Cook over a grill.,grill the sausages
grim,Not to be placated or appeased or moved by entreaty.,grim determination
grin,A facial expression characterized by turning up the corners of the mouth; usually shows pleasure or amusement.,Why do you grin?  Did I say something funny?
grip,The act of grasping.,he released his clasp on my arm
grocery store,A store where groceries can be purchased; supermarket.,
groom,A man participant in his own marriage ceremony.,
gross,Twelve dozen.,The movie grossed three million on the first weekend.
ground,The solid part of the earth's surface.,the plane turned away from the sea and moved back over land
ground floor,The floor of a building closest to ground level; what is also known by some American English speakers as the first floor.,
group,Any number of entities (members) considered as a unit.,A group of people gathered in front of the Parliament to demonstrate against the Prime Minister's proposals.
grouping,Any number of entities (members) considered as a unit.,group the dogs by hair colour
grow,"Pass into a condition gradually, take on a specific property or attribute; become.",The weather turned nasty
growing,(biology) the process of an individual organism growing organically; a purely biological unfolding of events involved in an organism changing gradually from a simple to a more complex level.,he proposed an indicator of osseous development in children
grown-up,An adult. (used especially by children).,
growth,(biology) the process of an individual organism growing organically; a purely biological unfolding of events involved in an organism changing gradually from a simple to a more complex level.,he proposed an indicator of osseous development in children
guarantee,A written assurance that some product or service will be provided or will meet certain specifications.,Can you give me a guarantee that he will be fit for the match?
guard,A person who keeps watch over something or someone.,"The prison guard unlocked the door of the cell.   After completing the repairs, he replaced the sump guard."
guerrilla,A member of an irregular armed force that fights a stronger force by sabotage and harassment.,
guess,A message expressing an opinion based on incomplete evidence.,He who guesses the riddle shall have the ring.
guest,A visitor to whom hospitality is extended.,The guests were let in by the butler.
guidance,Something that provides direction or advice as to a decision or course of action.,divine guidance
guide,Someone employed to conduct others.,The guide led us around the museum and explained the exhibits.
guidebook,Something that offers basic information or instruction.,
guideline,A light line that is used in lettering to help align the letters.,He considered the Ten Commandments more a guideline than a requirement.
guilt,The state of having committed an offense.,
guilty,Responsible for or chargeable with a reprehensible act.,guilty of murder
guitar,A stringed instrument usually having six strings; played by strumming or plucking.,
guitarist,A musician who plays the guitar.,
gulp,A large and hurried swallow.,he finished it at a single gulp
gum,A preparation (usually made of sweetened chicle) for chewing.,
gun,A weapon that discharges a missile at high velocity (especially from a metal tube or barrel).,Guns were considered improvements of crossbows and catapults.
gunshot,The act of shooting a gun.,the gunfire endangered innocent bystanders
guts,Fortitude and determination.,he didn't have the guts to try it
guy,An informal term for a youth or man.,a nice guy
gym,Athletic facility equipped for sports or physical training.,On Wednesdays I hike; on Fridays I gym.
gymnastic,Vigorously active.,an acrobatic dance
gymnastics,A sport that involves exercises intended to display strength and balance and agility.,Gymnastics was a significant part of the physical education curriculum.
habit,An established custom.,it was their habit to dine at 7 every evening
habitant,A person who inhabits a particular place.,
habitat,The type of environment in which an organism or group normally lives or occurs.,a marine habitat
had,"Have or possess, either in a concrete or an abstract sense.","She has $1,000 in the bank"
hail,Precipitation of ice pellets when there are strong rising air currents.,They say it's going to hail tomorrow.
hair,A covering for the body (or parts of it) consisting of a dense growth of threadlike structures (as on the human head); helps to prevent heat loss.,he combed his hair
haircut,The style in which hair has been cut.,
hairdresser,Someone who cuts or beautifies hair.,
hairdryer,"A small electrical appliance for drying hair, by generating a stream of hot air.",
hairy,Having or covered with hair.,Jacob was a hairy man
half,One of two equal parts of a divisible whole.,half a loaf
half-price,For half the price.,she bought it half-price during the sale
hall,An interior passage or corridor onto which rooms open.,the elevators were at the end of the hall
ham,Meat cut from the thigh of a hog (usually smoked).,a little piece of ham for the cat
hamburger,"A sandwich consisting of a fried cake of minced beef served on a bun, often with other ingredients.",I'm going to make you into hamburger if you do that again.
hammer,The part of a gunlock that strikes the percussion cap when the trigger is pulled.,Bobby used a hammer and nails to fix the two planks together
hand,The (prehensile) extremity of the superior limb.,he had the hands of a surgeon
handbag,A container used for carrying money and small personal items or accessories (especially by women).,she reached into her bag and found a comb
handball,A small rubber ball used in playing the game of handball.,"If the defender handballs in the penalty area, a penalty is awarded."
hand-held,Small and light enough to be operated while you hold it in your hands.,a hand-held computer
handicap,The condition of being unable to perform as a consequence of physical or mental unfitness.,reading disability
handicapped,People collectively who are crippled or otherwise physically handicapped.,technology to help the elderly and the disabled
handicraft,A work produced by hand labor.,
handkerchief,A square piece of cloth used for wiping the eyes or nose or as a costume accessory.,
handle,The appendage to an object that is designed to be held in order to use or move it.,he grabbed the hammer by the handle
handout,An announcement distributed to members of the press in order to supplement or replace an oral presentation.,"It's a place to get a hand up, not a handout."
handrail,A railing at the side of a staircase or balcony to prevent people from falling.,
handshake,Grasping and shaking a person's hand (as to acknowledge an introduction or to agree on a contract).,
handsome,Pleasing in appearance especially by reason of conformity to ideals of form and proportion; ; ; ; - thackeray; - lillian hellman.,a fine-looking woman
handwriting,Something written by hand.,she recognized his handwriting
handy,United states blues musician who transcribed and published traditional blues music (1873-1958).,Some people regard duct tape as a handy fix-all.
hang,A special way of doing something.,he had a bent for it
hanging,Decoration that is hung (as a tapestry) on a wall or over a window.,the cold castle walls were covered with hangings
happen,Come to pass.,What is happening?
happily,In a joyous manner.,they shouted happily
happiness,State of well-being characterized by emotions ranging from contentment to intense joy.,
happy,Enjoying or showing or marked by joy or pleasure.,a happy smile
harbor/harbour,A sheltered port where ships can take on or discharge cargo.,The neighborhood is a well-known harbor for petty thieves.
hard,Not easy; requiring great physical or mental effort to accomplish or comprehend or endure.,a difficult task
hard drive,A device used for storing large amounts of data for a computer that persist while the computer is turned off.,
hardly,Only a very short time before; ; ; ; ; - w.b.yeats.,they could barely hear the speaker
hardship,A state of misfortune or affliction.,debt-ridden farmers struggling with adversity
hardware,Major items of military weaponry (as tanks or missile).,military hardware
hard-working,"Of a person, taking their work seriously and doing it well and rapidly.",
harm,Any physical damage to the body caused by violence or accident or fracture etc.,No harm came to my possessions.
harmful,Causing or capable of causing harm.,too much sun is harmful to the skin
harmless,Not causing or capable of causing harm.,harmless bacteria
harmony,Compatibility in opinion and action.,a harmony of the Gospels
harness,A support consisting of an arrangement of straps for holding something to the body (especially one supporting a person suspended from a parachute).,They harnessed the horse to the post.
harrow,A cultivator that pulverizes or smooths the soil.,
harvest,The yield from plants in a single growing season.,Harvest is usually very damp and rainy.
has,(astronomy) the angular distance of a celestial point measured westward along the celestial equator from the zenith crossing; the right ascension for an observer at a particular location and time of day.,I have a house and a car.
haste,Overly eager speed (and possible carelessness).,he soon regretted his haste
hastily,In a hurried or hasty manner.,the way they buried him so hurriedly was disgraceful
hasty,Excessively quick.,made a hasty exit
hat,Headdress that protects the head from bad weather; has shaped crown and usually a brim.,
hatch,The production of young from an egg.,The cook passed the dishes through the serving hatch.
hatching,The production of young from an egg.,We got a good hatching from the swallowtail eggs.
hate,The emotion of intense dislike; a feeling of dislike so strong that it demands action.,One of my pet hates is traffic wardens.
hatred,The emotion of intense dislike; a feeling of dislike so strong that it demands action.,
haunt,A frequently visited place.,I went back the town I used to live and visited all my old haunts.
haunting,Follow stealthily or recur constantly and spontaneously to.,her ex-boyfriend stalked her
have,A person who possesses great material wealth.,I have a house and a car.
have to,,
haven,A shelter serving as a place of safety or sanctuary.,
hay,Grass mowed and cured for use as fodder.,
hazard,A source of danger; a possibility of incurring loss or misfortune.,drinking alcohol is a health hazard
hazardous,Involving risk or danger.,skydiving is a hazardous sport
he,A very light colorless element that is one of the six inert gasses; the most difficult gas to liquefy; occurs in economically extractable amounts in certain natural gases (as those found in texas and kansas).,Is your cat a he or a she?
head,The upper part of the human body or the front part of the body in animals; contains the face and brains.,he stuck his head out the window
headache,Something or someone that causes anxiety; a source of unhappiness.,New York traffic is a constant concern
headline,The heading or caption of a newspaper article.,"The headline on today's newspaper reads ""John Doe Wins Wood-Splitting Competition."""
headphone,Electro-acoustic transducer for converting electric signals into sounds; it is held over or inserted into the ear.,it was not the typing but the earphones that she disliked
headquarters,(usually plural) the office that serves as the administrative center of an enterprise.,many companies have their headquarters in New York
headteacher,The most senior teacher in a school who is responsible for its management and administration.,I had to go and see the headteacher about my attitude.
heal,Heal or recover.,My broken leg is mending
healing,The natural process by which the body repairs itself.,
health,A healthy state of wellbeing free from disease.,physicians should be held responsible for the health of their patients
health care,"The prevention, treatment, and management of illness or the preservation of mental and physical well-being through the services offered by the medical, nursing, and allied health professions.",I think free health care should also cover nearsightedness.
healthy,Having or indicating good health in body or mind; free from infirmity or disease.,a rosy healthy baby
heap,A collection of objects laid on top of each other.,a heap of earth or stones
hear,Perceive (sound) via the auditory sense.,"I was deaf, and now I can hear."
hearing,(law) a proceeding (usually by a court) where evidence is taken for the purpose of determining an issue of fact and reaching a decision based on that evidence.,"I was deaf, and now I can hear."
heart,The locus of feelings and intuitions.,in your heart you know it is true
heart attack,"An acute myocardial infarction, sometimes fatal, caused by the sudden occurrence of coronary thrombosis, which obstructs the blood supply to the heart and leads to necrosis of heart muscle tissue.",My computer had a heart attack when I tried to get it to run that program.
heartbreaking,Causing or marked by grief or anguish.,a grievous loss
