word,definition,example
motto,A favorite saying of a sect or political group.,
mount,A lightweight horse kept for riding only.,the mount of Jupiter
mountain,A land mass that projects well above its surroundings; higher than a hill.,We spent the weekend hiking in the mountains.
mountaintop,The summit of a mountain.,
mourn,Feel sadness.,She is mourning her dead child
mournful,Expressing sorrow.,
mouse,Any of numerous small rodents typically resembling diminutive rats having pointed snouts and small ears on elongated bodies with slender usually hairless tails.,Captain Higgins moused the hook with a bit of marline to prevent the block beckets from falling out under slack.
mouth,The opening through which food is taken in and vocalizations emerge.,he stuffed his mouth with candy
move,The act of deciding to do something.,he didn't make a move to help
movement,A change of position that does not entail a change of location.,the reflex motion of his eyebrows revealed his surprise
mover,Workman employed by a moving company.,the movers were very careful with the grand piano
movie,A form of entertainment that enacts a story by sound and a sequence of images giving the illusion of continuous movement.,they went to a movie every Saturday night
moving,"Change location; move, travel, or proceed, also metaphorically.",How fast does your new car go?
MP3 player,,
Mr./Mr,A form of address for a man.,
Mrs./Mrs,A form of address for a married woman.,
Ms./Ms,A form of address for a woman.,a labouring coal-meter
much,A great amount or extent.,they did much for humanity
mud,Water soaked soil; soft wet earth.,The campaign issues got lost in all the mud from both parties.
muddy,Dirty with mud.,If you muddy your shoes don't wear them inside.
mug,The quantity that can be held in a mug.,What an ugly mug.
mule,Hybrid offspring of a male donkey and a female horse; usually sterile.,
multiple,The product of a quantity by an integer.,36 is a multiple of 9
multiply,Combine by multiplication.,multiply 10 by 15
mum,Of china.,
mumble,A soft indistinct utterance.,All I could hear was a mumble from the next room.
murder,Unlawful premeditated killing of a human being by a human being.,The defendant was charged with murder.
murderer,A criminal who commits homicide (who performs the unlawful premeditated killing of another human being).,
murmur,A low continuous indistinct sound; often accompanied by movement of the lips without the production of articulate speech.,A murmur arose from the audience.
muscle,One of the contractile organs of the body.,Muscle consists largely of actin and myosin filaments.
muse,In ancient greek mythology any of 9 daughters of zeus and mnemosyne; protector of an art or science.,
museum,A depository for collecting and displaying objects having scientific or historical or artistic value.,
mushroom,Common name for an edible agaric (contrasting with the inedible toadstool).,"Some mushrooms are edible and taste good, while others are poisonous and taste foul."
music,An artistic form of auditory communication incorporating instrumental or vocal tones in a structured and continuous manner.,I keep listening to this music because it's a masterpiece.
musical,A play or film whose action and dialogue is interspersed with singing and dancing.,musical proportion; musical instruments
musician,Someone who plays a musical instrument (as a profession).,
must,A necessary or essential thing.,seat belts are an absolute must
mustache/moustache,An unshaved growth of hair on the upper lip.,he looked younger after he shaved off his mustache
mustard,Any of several cruciferous plants of the genus brassica.,"When the waitress brought the food, I asked whether she had any Dijon mustard."
mutability,The quality of being capable of mutation.,
mutable,Capable of or tending to change in form or quality or nature.,a mutable substance
mutter,A low continuous indistinct sound; often accompanied by movement of the lips without the production of articulate speech.,"The prisoners were docile, and accepted their lot with barely a mutter."
mutton,Meat from a mature domestic sheep.,
mutual,Common to or shared by two or more parties.,a common friend
my,"Used to express surprise, shock or amazement.","My, what big teeth you have!"
myself,"(reflexive pronoun) Me, as direct or indirect object the speaker as the object of a verb or preposition, when the speaker is also the subject.",I taught myself.
mysterious,Of an obscure nature; ; ; ; - rachel carson.,the new insurance policy is written without cryptic or mysterious terms
mystery,Something that baffles understanding and cannot be explained.,how it got out is a mystery
mystify,Be a mystery or bewildering to.,This beats me!
myth,A traditional story accepted as history; serves to explain the world view of a people.,"Myth was the product of man's emotion and imagination, acted upon by his surroundings. (E. Clodd, Myths & Dreams (1885), 7, cited after OED)"
nail,Horny plate covering and protecting part of the dorsal surface of the digits.,When I'm nervous I bite my nails.
naked,Completely unclothed.,bare bodies
name,A language unit by which a person or thing is known.,his name really is George Washington
nano,Nanotechnology.,
nap,A period of time spent sleeping.,he felt better after a little sleep
napkin,A small piece of table linen that is used to wipe the mouth and to cover the lap in order to protect clothing.,
narcissistic,Characteristic of those having an inflated idea of their own importance.,
narrate,"Provide commentary for a film, for example.",
narrative,A message that tells the particulars of an act or occurrence or course of events; presented in writing or drama or cinema or as a radio or television program.,his narrative was interesting
narrator,Someone who tells a story.,
narrow,A narrow strait connecting two bodies of water.,the narrows of New York harbor
narrowly,In a narrow manner; not allowing for exceptions.,he interprets the law narrowly
nasty,Offensive or even (of persons) malicious; ; ; ; ; ; - ezra pound.,in a nasty mood
nation,A politically organized body of people under a single government.,the state has elected a new president
national,A person who owes allegiance to that nation.,a monarch has a duty to his subjects
nationalist,One who loves and defends his or her country.,You are either a globalist or a nationalist; one cannot be both.
nationality,People having common origins or traditions and often comprising a nation.,immigrants of the same nationality often seek each other out
nationwide,Occurring or extending throughout a country or nation.,the event aroused nationwide interest
native,An indigenous person who was born in a particular place.,the art of the natives of the northwest coast
native speaker,A person who grew up with a particular language as their mother tongue.,Native speakers of English get paid much more than locals in the schools.
natural,Someone regarded as certain to succeed.,he's a natural for the job
naturally,As might be expected.,"naturally, the lawyer sent us a huge bill"
nature,The essential qualities or characteristics by which something is recognized.,it is the nature of fire to burn
naughty,Suggestive of sexual impropriety.,a blue movie
naval,Connected with or belonging to or used in a navy.,naval history
navigate,Travel on water propelled by wind or by other means.,The QE2 will sail to Southampton tomorrow
navigation,The guidance of ships or airplanes from place to place.,
navy,An organization of military vessels belonging to a country and available for sea warfare.,
navy blue,A dark blue color.,
near,Move towards.,We were approaching our destination
nearby,Close at hand.,the nearby towns
nearly,(of actions or states) slightly short of or not quite accomplished; all but.,the job is (just) about done
neat,Clean or organized.,her neat dress
necessarily,In an essential manner.,such expenses are necessarily incurred
necessary,Anything indispensable.,food and shelter are necessities of life
necessity,The condition of being essential or indispensable.,I bought a new table out of necessity. My old one was ruined.
neck,The part of an organism (human or animal) that connects the head to the rest of the body.,he admired her long graceful neck
necklace,Jewelry consisting of a cord or chain (often bearing gems) worn about the neck as an ornament (especially by women).,a necklace of coral islands
nectar,A sweet liquid secretion that is attractive to pollinators.,
need,A condition requiring relief.,she satisfied his need for affection
needle,The leaf of a conifer.,The seamstress threaded the needle to sew on a button.
needless,Unnecessary and unwarranted.,a strikers' tent camp...was burned with needless loss of life
needy,Needy people collectively.,they try to help the needy
negative,A reply of denial.,he answered in the negative
negatively,In a harmful manner.,he was negatively affected
neglect,Lack of attention and due care.,to neglect duty or business;  to neglect to pay debts
negotiate,Discuss the terms of an arrangement.,They negotiated the sale of the house
negotiation,A discussion intended to produce an agreement.,the buyout negotiation lasted several days
neighbor/neighbour,A person who lives (or is located) near another.,My neighbour has two noisy cats.
neighborhood/neighbourhood,A surrounding or nearby region.,the plane crashed in the vicinity of Asheville
neighboring/neighbouring,Live or be located as a neighbor.,the neighboring house
neither,Not either; not one or the other.,"Just as you would not correct it, neither would I."
nephew,A son of your brother or sister.,
nerve,Any bundle of nerve fibers running to various organs and tissues of the body.,The nerves can be seen through the skin.
nerves,An uneasy psychological state.,he suffered an attack of nerves
nervous,Easily agitated.,a nervous addict
nervously,In an anxiously nervous manner.,we watched the stock market nervously
nervousness,The anxious feeling you have when you have the jitters.,
ness,A strip of land projecting into a body of water.,
net,A computer network consisting of a worldwide network of computer networks that use the tcp/ip network protocols to facilitate data transmission and exchange.,
netsurfer/net surfer,,
network,An interconnected system of things or people.,he owned a network of shops
neurosis,A mental or personality disturbance not attributable to any known neurological or organic dysfunction.,
neutral,One who does not side with any party in a war or dispute.,I am neutral regarding the issue of gay marriage.
never,Not ever; at no time in the past or future.,I have never been to China
nevertheless,Despite anything to the contrary (usually following a concession).,"although I'm a little afraid, however I'd like to try it"
new,Not of long duration; having just (or relatively recently) come into being or been made or acquired or discovered.,a new law
newborn,A baby from birth to four weeks.,
newcomer,Any new participant in some activity.,
newly,Very recently.,they are newly married
news,Information about recent and important events.,they awaited news of the outcome
newscaster,Someone who broadcasts the news.,
newspaper,A daily or weekly publication on folded sheets; contains news and articles and advertisements.,he read his newspaper at breakfast
newsworthy,Sufficiently interesting to be reported in a newspaper.,
next,Immediately following in time or order.,the following day
next door,(usually postpositive) That is in an adjacent place; that is located next door.,Try the place next door.
next to,"Beside, alongside, by, adjacent to, or near.",Cleanliness is next to godliness.
next-door,"In an adjacent building, room or place.",
nice,A city in southeastern france on the mediterranean; the leading resort on the french riviera.,What is a nice person like you doing in a place like this?
nicely,In a nice way.,a nicely painted house
nickname,A familiar name for a person (often a shortened version of a person's given name).,Joe's mother would not use his nickname and always called him Joseph
niece,A daughter of your brother or sister.,My niece just celebrated her 15th birthday.
night,The time after sunset and before sunrise while it is dark outside.,How do you sleep at night when you attack your kids like that!?
nightclub,A spot that is open late at night and that provides entertainment (as singers or dancers) as well as dancing and food and drink.,don't expect a good meal at a cabaret
nightlife,The entertainment available to people seeking nighttime diversion.,Rio de Janeiro boasts the best nightlife in South America.
nightmare,A situation resembling a terrifying dream.,I had a nightmare that I tried to run but could neither move nor breathe.
nine,The cardinal number that is the sum of eight and one.,"They guaranteed that our Web site would have 99.99% uptime, or four nines."
nineteen,The cardinal number that is the sum of eighteen and one.,
ninety,The cardinal number that is the product of ten and nine.,
no,A negative.,his no was loud and clear
no one,"Used in contrast to anyone, someone or everyone: not one person; nobody.",We went to the store but no one was there.
nobility,A privileged class holding hereditary titles.,
noble,A titled peer of the realm.,This country house was occupied by nobles in the 16th century.
nobleman,A titled peer of the realm.,
nobody,A person of no influence.,"Whether you're a nobody or a player, everyone in Tinseltown wants to be King of Hollywood! - Conquering Hollywood"
nod,A sign of assent or salutation or command.,"For the fifth time in her career she received a Grammy nod, she has yet to win the award."
noise,Sound of any kind (especially unintelligible or dissonant sound).,he enjoyed the street noises
noisily,With much noise or loud and unpleasant sound.,he blew his nose noisily
noisy,Full of or characterized by loud and nonmusical sounds.,a noisy cafeteria
nomad,A member of a people who have no permanent home but move about according to the seasons.,
nomination,The act of officially naming a candidate.,the Republican nomination for Governor
nominee,A politician who is running for public office.,
none,A canonical hour that is the ninth hour of the day counting from sunrise.,I felt none the worse for my recent illness.
nonetheless,Despite anything to the contrary (usually following a concession).,"although I'm a little afraid, however I'd like to try it"
nonprofessional,Not professional; not engaged in a profession or engaging in as a profession or for gain.,the nonprofessional wives of his male colleagues
nonsense,A message that seems to convey no meaning.,"After my father had a stroke, every time he tried to talk, it sounded like nonsense."
non-smoking,Having restrictions on smoking.,We want a table in the non-smoking sector.
noon,The middle of the day.,"1885, When night was at its noon I heard a voice chanting the Koran in sweetest accents — Sir Richard Burton, The Book of the Thousand Nights and One Night, Night 17:"
nor,"And not (introducing a negative statement, without necessarily following one).","Nor did I stop to think, but ran."
normal,Something regarded as a normative example.,the convention of not naming the main character
normally,Under normal conditions.,usually she was late
north,The region of the united states lying to the north of the mason-dixon line.,Minnesota is in the north of the USA.
northeast,The compass point midway between north and east; at 45 degrees.,
northeastern,Situated in or oriented toward the northeast.,the northeasterly part of the island
northern,A dialect of middle english that developed into scottish lallans.,Les Dawson was a famous northern comedian.
northward,The cardinal compass point that is at 0 or 360 degrees.,
northwest,The northwestern region of the united states.,
northwestern,Situated in or oriented toward the northwest.,
nose,The organ of smell and entrance to the respiratory tract; the prominent part of the face of man or other mammals.,he has a cold in the nose
nostril,Either one of the two external openings to the nasal cavity in the nose.,
not,Negation of a word or group of words.,he does not speak French
note,A brief written record.,he made a note of the appointment
notebook,A book with blank pages for recording notes or memoranda.,
nothing,A quantity of no importance.,it looked like nothing I had ever seen before
notice,"An announcement containing information about an event; ; ; ""a notice of sale.",you didn't give me enough notice
noticeable,Capable or worthy of being perceived.,noticeable shadows under her eyes
noticeboard,"A board, hanging on a wall, on which notices and announcements are posted.",
notion,A vague idea in which some confidence is placed.,his impression of her was favorable
notorious,Known widely and usually unfavorably.,a notorious gangster
nought,A mathematical element that when added to another number yields the same number.,0.4 — nought point four / zero point four
noun,"A content word that can be used to refer to a person, place, thing, quality, or action.",
nourish,Provide with nourishment.,We sustained ourselves on bread and water
nourishment,A source of materials to nourish the body.,
novel,An extended fictional work in prose; usually in the form of a story.,
novelist,One who writes novels.,
novelty,Originality by virtue of being refreshingly novel.,
November,The month following october and preceding december.,
now,The momentary present.,Now is a good time to do it
nowadays,The period of time that is happening now; any continuous stretch of time including the moment of speech.,that is enough for the present
nowhere,An insignificant place.,he came out of nowhere
nuclear,(weapons) deriving destructive energy from the release of atomic energy.,nuclear war
nucleus,A part of the cell containing dna and rna and responsible for growth and reproduction.,This collection will form the nucleus of a new library.
nuisance,(law) a broad legal concept including anything that disturbs the reasonable use of your property or endangers life and health or is offensive.,a public nuisance
number,The property possessed by a sum or total or indefinite quantity of units or individuals.,he had a number of chores to do
numerical,Measured or expressed in numbers.,numerical value
numerous,Amounting to a large indefinite number.,numerous times
nurse,One skilled in caring for young children or the sick (usually under the supervision of a physician).,They hired a nurse to care for their young boy.
nursery,A child's room for a baby.,Commerce is the nursery of seamen.
nut,Usually large hard-shelled seed.,"There are many sort of nuts: peanuts, cashews, pistachios, Brazil nuts and more."
nutrient,Any substance that can be metabolized by an animal to give energy and build tissue.,
nutrition,(physiology) the organic process of nourishing or being nourished; the processes by which an organism assimilates food and uses it for growth and maintenance.,
nutritious,Of or providing nourishment.,good nourishing stew
nutshell,The shell around the kernel of a nut.,
oak,The hard durable wood of any oak; used especially for furniture and flooring.,"an oak table, oak beam, etc"
oath,Profane or obscene expression usually of surprise or anger.,expletives were deleted
obedience,The act of obeying; dutiful or submissive behavior with respect to another person.,Obedience is essential in any army.
obedient,Dutifully complying with the commands or instructions of those in authority; ; ; ; - edmund burke.,an obedient soldier
obey,Be obedient to.,
obituary,A notice of someone's death; usually includes a short biography.,
object,A tangible and visible entity; an entity that can cast a shadow.,"it was full of rackets, balls and other objects"
objection,The act of expressing earnest opposition or protest.,I have no objection to any person's religion.
objective,The goal intended to be attained (and which is believed to be attainable).,the sole object of her trip was to see her children
obligation,The social force that binds you to the courses of action demanded by that force; ; - john d.rockefeller jr.,we must instill a sense of duty in our children
observation,The act of making and recording a measurement.,
observe,"Discover or determine the existence, presence, or fact of.",She detected high levels of lead in her drinking water
observer,A person who becomes aware (of things or events) through the senses.,Most impartial observers agreed that Sampras had not served well.
obsess,Haunt like a ghost; pursue.,Fear of illness haunts her
obsession,"An irrational motive for performing trivial or repetitive actions, even against your will.",her compulsion to wash her hands repeatedly
obsessive,A person who has obsessions.,"The idea is too tempting, it's obsessive."
obstacle,Something immaterial that stands in the way and must be circumvented or surmounted.,lack of imagination is an obstacle to one's advancement
obtain,Come into possession of.,How did you obtain the visa?
obvious,Easily perceived by the senses or grasped by the mind.,obvious errors
obviously,Unmistakably (`plain' is often used informally for `plainly').,the answer is obviously wrong
occasion,An event that occurs at a critical time.,at such junctures he always had an impulse to leave
occasional,Occurring from time to time.,took an occasional glass of wine
occasionally,Now and then or here and there.,he was arrogant and occasionally callous
occupation,The principal activity in your life that you do to earn money.,he's not in my line of business
occupy,Keep busy with.,She busies herself with her butterfly collection
occur,Come to pass.,What is happening?
ocean,A large body of water constituting a principal part of the hydrosphere.,The island is surrounded by ocean
o'clock,According to the clock.,it's three o'clock in Tokyo now
October,The month following september and preceding november.,
odd,Not divisible by two.,So let's see. There are two evens here and three odds.
of,Expressing distance or motion.,
off,Kill intentionally and with premeditation.,The mafia boss ordered his enemies murdered
offend,Cause to feel resentment or indignation.,Her tactless remark offended me
offender,A person who transgresses moral or civil law.,
offense/offence,A lack of politeness; a failure to show regard for others; wounding the feelings or others.,
offensive,The action of attacking an enemy.,The Marines today launched a major offensive.
offer,The verbal act of offering.,a generous offer of assistance
offhand,With little or no preparation or forethought.,his ad-lib comments showed poor judgment
office,Place of business where professional or clerical duties are performed.,he rented an office in the new building
officer,Any person in the armed services who holds a position of authority or command.,an officer is responsible for the lives of his men
official,A worker who holds or is invested with an office.,David Barnes was the official charged with the running of the sports club.
officially,In an official role.,"officially, he is in charge"
offshore,(of winds) coming from the land.,offshore winds
often,Many times at short intervals.,we often met over a cup of coffee
oil,A slippery or viscous liquid or liquefiable substance not miscible with water.,I prefer to paint in oil
oily,Containing an unusual amount of grease or oil.,greasy hamburgers
ointment,Semisolid preparation (usually containing a medicine) applied externally as a remedy or for soothing an irritation.,
OK/okay,A state in south central united states.,Do you think it's OK to stay here for the night?
old,Past times (especially in the phrase `in days of old').,A civilised society should always look after the old in the community.
old-fashioned,Out of fashion.,a suit of rather antique appearance
olive,Small ovoid fruit of the european olive tree; important food and source of oil.,a beef olive
olive oil,"A vegetable oil, pressed from olives, and used in cooking and as a salad dressing; it is high in unsaturated fatty acids.",
Olympia,Capital of the state of washington; located in western washington on puget sound.,
Olympiad,One of the four-year intervals between olympic games; used to reckon time in ancient greece for twelve centuries beginning in 776 bc.,
Olympic,Of or relating to the olympic games.,Olympic winners
Olympics,The modern revival of the ancient games held once every 4 years in a selected country.,
omelet/omelette,Beaten eggs or an egg mixture cooked until just set; may be folded around e.g. ham or cheese or jelly.,
on,In operation or operational.,left the oven on
once,On one occasion.,once I ran into her
one,The smallest whole number or a numeral representing this number.,he has the one but will need a two and three to go with it
oneself,"A person's self: general form of himself, herself, themself or yourself.",Teaching oneself to swim can be dangerous.
onion,The bulb of an onion plant.,
online,On a regular route of a railroad or bus or airline system.,on-line industries
only,Being the only one; single and isolated from others.,the lone doctor in the entire county
onstage,Situated or taking place on the area of a stage visible to the audience.,
onto/on to,(of a function) Assuming each of the values in its codomain; having its range equal to its codomain.,"Considered as a function on the real numbers, the exponential function is not onto."
open,A clear or unobstructed space or expanse of land or water.,finally broke out of the forest into the open
opening,An open or empty space in or between things.,there was a small opening between the trees
openly,In an open way.,he openly flaunted his affection for his sister
opera,A drama set to music; consists of singing with orchestral accompaniment and an orchestral overture and interludes.,
operate,"Direct or control; projects, businesses, etc.",She is running a relief operation in the Sudan
operation,The state of being in effect or being operative.,that rule is no longer in operation
