word,definition,example
a,A metric unit of length equal to one ten billionth of a meter (or 0.0001 micron); used to specify wavelengths of electromagnetic radiation.,
a.m./A.M./am/AM,Before noon.,
abandon,The trait of lacking restraint or control; reckless freedom from inhibition or worry.,she danced with abandon
abandoned,"Forsake, leave behind.",We abandoned the old car in the empty parking lot
ability,The quality of being able to perform; a quality that permits or facilitates achievement or accomplishment.,This phone has the ability to have its software upgraded wirelessly.
able,(usually followed by `to') having the necessary means or skill or know-how or authority to do something.,able to swim
abnormal,Not normal; not typical or usual or regular or conforming to a norm.,abnormal powers of concentration
abnormally,In an abnormal manner.,they were behaving abnormally
aboard,"On a ship, train, plane or other vehicle.",We all climbed aboard.
abolish,Do away with.,Slavery was abolished in the mid-19th century in America and in Russia
aboriginal,A dark-skinned member of a race of people living in australia when europeans arrived.,
aborigine,An indigenous person who was born in a particular place.,the art of the natives of the northwest coast
about,On the move.,up and about
above,An earlier section of a written text.,for instructions refer to the above
abroad,In a foreign country.,markets abroad
abruptly,Quickly and without warning.,he stopped suddenly
absence,The state of being absent.,he was surprised by the absence of any explanation
absent,Go away or leave.,He absented himself
absentee,One that is absent or not in residence.,
absolute,Something that is conceived or that exists independently and not in relation to other things; something that does not depend on anything else and is beyond human control; something that is not relative.,no mortal being can influence the absolute
absolutely,Completely and without qualification; used informally as intensifiers.,an absolutely magnificent painting
absorb,Become imbued.,"The liquids, light, and gases absorb"
abstract,A concept or idea not associated with any specific instance.,he loved her only in the abstract--not in person
absurd,A situation in which life seems irrational and meaningless; --albert camus.,The absurd is the essential concept and the first truth
abundance,The property of a more than adequate quantity or supply.,an age of abundance
abundant,Present in great quantity.,an abundant supply of water
abuse,Cruel or inhumane treatment.,the child showed signs of physical abuse
academic,An educator who works at a college or university.,the academic sect or philosophy
academy,A secondary school (usually private).,the military academy at West Point; a riding academy; the Academy of Music.; a music academy; a language academy
accent,Distinctive manner of oral expression.,he couldn't suppress his contemptuous accent
accept,Consider or hold as true.,I cannot accept the dogma of this church
acceptable,Worthy of acceptance or satisfactory.,acceptable levels of radiation
acceptance,The mental attitude that something is believable and should be accepted as true.,he gave credence to the gossip
access,The right to enter.,an access of territory
accessibility,The quality of being at hand when needed.,
accessible,Capable of being reached.,a town accessible by rail
accessory,"Clothing that is worn or carried, but not part of your main clothing.",She was accessory to the riot.
accident,An unfortunate mishap; especially one causing damage or injury.,to die by an accident
accidental,A musical notation that makes a note sharp or flat or natural although that is not part of the key signature.,
accidentally,Without advance planning.,they met accidentally
accommodation,Making or becoming suitable; adjusting to circumstances.,
accompany,Be present or associated with an event or entity.,French fries come with the hamburger
accomplish,Put in effect.,carry out a task
according to,,
accordingly,(sentence connectors) because of the reason given.,"consequently, he didn't do it"
account,A record or narrative description of past events.,a history of France
accountant,Someone who maintains and audits business accounts.,
accumulate,Get or gather together.,I am accumulating evidence for the man's unfaithfulness to his wife
accuracy,The quality of being near to the true value.,he was beginning to doubt the accuracy of his compass
accurate,Conforming exactly or almost exactly to fact or to a standard or performing with total accuracy.,an accurate reproduction
accurately,With few mistakes.,he works very accurately
accusation,A formal charge of wrongdoing brought against a person; the act of imputing blame or guilt.,
accuse,Bring an accusation against; level a charge against.,The neighbors accused the man of spousal abuse
accustom,Make psychologically or physically used (to something).,She became habituated to the background music
ache,A dull persistent (usually moderately intense) pain.,
achievable,Capable of existing or taking place or proving true; possible to do.,
achieve,To gain with effort.,she achieved her goal despite setbacks
achievement,The action of accomplishing something.,Finishing the game does not give you a 100% score until you have unlocked all of the achievements.
acid,Any of various water-soluble compounds having a sour taste and capable of turning litmus red and reacting with a base to form a salt.,acid fruits or liquors
acknowledge,Declare to be true or admit the existence or reality or truth of.,He admitted his errors
acknowledgment/acknowledgement,The state or quality of being recognized or acknowledged.,the partners were delighted with the recognition of their work
acquaintance,Personal knowledge or information about someone or something.,I know of the man; but have no acquaintance with him.
acquire,Come into the possession of something concrete or abstract.,She got a lot of paintings from her uncle
acquisition,The act of contracting or assuming or acquiring possession of something.,the acquisition of wealth
across,To the opposite side.,the football field was 300 feet across
act,A legal document codifying the result of deliberations of a committee or society or legislative body.,an act of goodwill
action,Something done (usually as opposed to something said).,there were stories of murders and other unnatural actions
active,Chemical agent capable of activity.,certain active principles
actively,In an active manner.,he participated actively in the war
activity,Any specific behavior.,they avoided all recreational activity
actor,A theatrical performer.,
actress,A female actor.,
actual,Presently existing in fact and not merely potential or possible.,the predicted temperature and the actual temperature were markedly different
actually,In actual fact.,to be nominally but not actually independent
acute,A mark (') placed above a vowel to indicate pronunciation.,The word ‘cafe’ often has an acute over the ‘e’.
ad,A public promotion of some product or service.,I have placed both of the ads in the newspaper as instructed.
adapt,"Make fit for, or change to suit a new purpose.",Adapt our native cuisine to the available food resources of the new country
adaptable,Capable of adapting (of becoming or being made suitable) to a particular situation or use.,to succeed one must be adaptable
add,A condition (mostly in boys) characterized by behavioral and learning disorders.,"When the player has fought the boss for one minute, two adds will arrive from the back and must be dealt with."
addict,Someone who is so ardently devoted to something that it resembles an addiction.,a golf addict
addicted,"To cause (someone or oneself) to become dependent (on something, especially a narcotic drug).",
addiction,Being abnormally tolerant to and dependent on something that is psychologically or physically habit-forming (especially alcohol or narcotic drugs).,
addition,A component that is added to something to improve it.,the addition of a bathroom was a major improvement
additional,Further or added.,called for additional troops
additionally,"In addition, by way of addition; furthermore.",he serves additionally as the CEO
address,(computer science) the code that identifies where a piece of information is stored.,"He addressed some portions of his remarks to his supporters, some to his opponents."
addressee,One to whom something is addressed.,
adequate,Having the requisite qualities or resources to meet a task.,she had adequate training
adequately,In an adequate manner or to an adequate degree.,he was adequately prepared
adjective,A word that expresses an attribute of something.,The words “big” and “heavy” are English adjectives.
adjust,Alter or regulate so as to achieve accuracy or conform to a standard.,"Adjust the clock, please"
adjustment,Making or becoming suitable; adjusting to circumstances.,The credit card company made an adjustment to my account to waive the late fee.
administration,A method of tending to or managing the affairs of a some group of people (especially the group's business affairs).,Successive US administrations have had similar Middle East policies.
administrative,Of or relating to or responsible for administration.,
admirable,Deserving of the highest esteem or admiration.,an estimable young professor
admiration,A feeling of delighted approval and liking.,They looked at the landscape in admiration.
admire,Feel admiration for.,He had always admired the work ethos and family values of his friend.
admiringly,With admiration.,he looked at his wife admiringly
admission,The act of admitting someone to enter.,the surgery was performed on his second admission to the clinic
admit,Declare to be true or admit the existence or reality or truth of.,He admitted his errors
admittedly,As acknowledged.,"true, she is the smartest in her class"
adopt,"Choose and follow; as of theories, ideas, policies, strategies or plans.",She followed the feminist movement
adopted,"Choose and follow; as of theories, ideas, policies, strategies or plans.",She followed the feminist movement
adoption,The act of accepting with approval; favorable reception.,its adoption by society
adorable,Lovable especially in a childlike or naive way.,
adore,Love intensely.,he just adored his wife
adorn,"Make more attractive by adding ornament, colour, etc.",Decorate the room for the party
adult,A fully developed person from maturity onward.,"an adult human, animal, or plant"
advance,A movement forward.,he listened for the progress of the troops
advanced,"Move forward, also in the metaphorical sense.",Time marches on
advancement,Encouragement of the progress or growth or acceptance of something.,the advancement of learning
advantage,The quality of having a superior or more favorable position.,the experience gave him the advantage over me
advent,Arrival that has been awaited (especially of something momentous).,the advent of the computer
adventure,A wild and exciting undertaking (not necessarily lawful).,A life full of adventures.
adventurous,Willing to undertake or seeking out new and daring enterprises.,adventurous pioneers
adverb,The word class that qualifies verbs or clauses.,I often went outside hiking during my stay in Japan.
adverbial,A word or group of words function as an adverb.,
adverse,Contrary to your interests or welfare.,adverse circumstances
adversely,In an adverse manner.,she was adversely affected by the new regulations
adversity,A state of misfortune or affliction.,debt-ridden farmers struggling with adversity
advert,A public promotion of some product or service.,
advertise,Call attention to.,Please don't advertise the fact that he has AIDS
advertisement,A public promotion of some product or service.,"Companies try to sell their products using advertisements in form of placards, television spots and print publications."
advertising,A public promotion of some product or service.,"For personal needs, advertise on the internet or in a local newspaper."
advice,A proposal for an appropriate course of action.,She was offered various piece of advice on what to do with her new-found wealth.
advise,Give advice to.,The teacher counsels troubled students
adviser/advisor,An expert who gives advice.,an adviser helped students select their courses
aerobics,Exercise that increases the need for oxygen.,
affair,A vaguely specified concern.,several matters to attend to
affect,The conscious subjective aspect of feeling or emotion.,The experience affected me deeply.
affection,A positive feeling of liking.,he had trouble expressing the affection he felt
affectionate,Having or displaying warmth or affection.,affectionate children
affectionately,With affection.,she loved him dearly
afford,Be able to spare or give up.,I can't afford to spend two hours with this person
affordable,That you have the financial means for.,low-cost housing
afraid,Filled with fear or apprehension.,afraid even to turn his head
after,Located farther aft.,The after gun is abaft the forward gun.
afternoon,The part of the day between noon and evening.,he spent a quiet afternoon in the park
afterward,Happening at a time subsequent to a reference time.,he apologized subsequently
afterwards,Happening at a time subsequent to a reference time.,he apologized subsequently
again,Anew.,she tried again
against,In a contrary direction to.,It is hard work to swim against the current.
age,How long something has existed.,it was replaced because of its age
aged,People who are old collectively.,special arrangements were available for the aged
ageless,Continuing forever or indefinitely.,the ageless themes of love and revenge
agency,An administrative unit of government.,the Central Intelligence Agency
agenda,A temporally organized plan for matters to be attended to.,
agent,An active and efficient cause; capable of producing a certain effect.,their research uncovered new disease agents
aggressive,Having or showing determination and energetic pursuit of your ends.,an aggressive businessman
aggressively,In an aggressive manner.,she was being sharply questioned
ago,Gone by; or in the past.,two years ago
agonize/agonise,Cause to agonize.,
agony,Intense feelings of suffering; acute mental or physical pain.,an agony of doubt
agree,Be in accord; be in agreement.,We agreed on the terms of the settlement
agreement,The statement (oral or written) of an exchange of promises.,they had an agreement that they would not interfere in each other's business
agricultural,Relating to or used in or promoting agriculture or farming.,agricultural engineering
agriculture,A large-scale farming enterprise.,
ahead,Having the leading position or higher score in a contest.,he is ahead by a pawn
aid,A resource.,visual aids in teaching
aim,An anticipated outcome that is intended or that guides your planned actions.,his intent was to provide a new translation
air,A mixture of gases (especially oxygen) required for breathing; the stuff that the wind consists of.,air pollution
air conditioning,The state of temperature and humidity produced by an air conditioner.,This car has air conditioning.
air force,"A branch of the military mainly devoted to air warfare, as opposed to (land) army and navy.",When you're in the air force you have to be prepared to launch missiles at people from the air.
aircraft,A vehicle that can fly.,
aircrew,The crew of an aircraft.,The aircrew ran to the bomber.
airline,A hose that carries air under pressure.,
airplane/aeroplane,An aircraft that has a fixed wing and is powered by propellers or jets.,the flight was delayed due to trouble with the airplane
airport,An airfield equipped with control tower and hangars as well as accommodations for passengers and cargo.,"Because of this, and contrary to popular belief, British airports primarily act as giant wealth extractors, transporting our richest citizens out of the country as often as possible to take their money overseas. ― The Independent, Heathrow expansion to mainly benefit wealthy frequent fliers, research finds, 23 june 2018."
aisle,A long narrow passage (as in a cave or woods).,Do you want to seat window or aisle?
alarm,Fear resulting from the awareness of danger.,The clock radio is a friendlier version of the cold alarm by the bedside.
alarm clock,A clock with an alarm that can be set to sound at a determined time.,
album,One or more recordings issued together; originally released on 12-inch phonograph records (usually with attractive record covers) and later on cassette audiotape and compact disc.,
alcohol,A liquor or brew containing alcohol as the active agent.,alcohol (or drink) ruined him
alcoholic,A person who drinks alcohol to excess habitually.,He ordered an alcoholic beverage.
alcoholism,Habitual intoxication; prolonged and excessive intake of alcoholic drinks leading to a breakdown in health and an addiction to alcohol such that abrupt deprivation leads to severe withdrawal symptoms.,
alert,Condition of heightened watchfulness or preparation for action.,bombers were put on alert during the crisis
alike,Having the same or similar characteristics.,all politicians are alike
alive,Possessing life.,the happiest person alive
all,Quantifier; used with either mass or count nouns to indicate the whole number or amount of or every one of a class.,we sat up all night
all right,"Good; in acceptable, if not excellent condition.","The car is all right. It gets me there, anyway."
allegation,(law) a formal accusation against somebody (often in a court of law).,an allegation of malpractice
allergic,Characterized by or caused by allergy.,an allergic reaction
alliance,The state of being allied or confederated.,"matrimonial alliances; an alliance between church and state, or between two countries"
allow,Make it possible through a specific action or lack of action for something to happen.,This permits the water to rush in
allowance,An amount allowed or granted (as during a given period).,travel allowance
ally,A friendly nation.,the two countries were allies in WWI
almost,(of actions or states) slightly short of or not quite accomplished; all but.,the job is (just) about done
alone,Isolated from others.,could be alone in a crowded room
along,With a forward motion.,we drove along admiring the view
alongside,Side by side.,anchored close aboard another ship
aloud,Using the voice; not silently.,please read the passage aloud
alphabet,A character set that includes letters and is used to write a language.,"In the first year of school, pupils are taught to recite the alphabet."
alphabetical,Relating to or expressed by a writing system that uses an alphabet.,alphabetical writing system
already,Prior to a specified or implied time.,she has already graduated
alright,Nonstandard usage.,"The car is all right. It gets me there, anyway."
also,In addition.,"he has a Mercedes, too"
altar,The table in christian churches where communion is given.,
alter,Cause to change; make different; cause a transformation.,The advent of the automobile may have altered the growth pattern of the city
alternate,Someone who takes the place of another person.,The flood and ebb tides alternate with each other.
alternative,One of a number of things from which only one can be chosen.,what option did I have?
alternatively,"In place of, or as an alternative to.",Felix became a herpetologist instead
although,"Though, even though, in spite of or despite the fact that: introducing a clause that expresses a concession.","Although it was very muddy, the football game went on."
altitude,Elevation especially above sea level or above the earth's surface.,the altitude gave her a headache
altogether,Informal terms for nakedness.,in the raw
aluminum/aluminium,A silvery ductile metallic element found primarily in bauxite.,
always,At all times; all the time and on every occasion.,I will always be there to help you
am,A radioactive transuranic metallic element; discovered by bombarding uranium with helium atoms.,
amaze,Affect with wonder.,Your ability to speak six languages amazes me!
amazed,Affect with wonder.,Your ability to speak six languages amazes me!
amazement,The feeling that accompanies something extremely surprising.,he looked at me in astonishment
amazing,Affect with wonder.,Your ability to speak six languages amazes me!
amazingly,In an amazing manner; to everyone's surprise.,"amazingly, he finished medical school in three years"
ambassador,A diplomat of the highest rank; accredited as representative from one country to another.,"As front hall porter, you are an ambassador for the hotel."
ambiguity,An expression whose meaning cannot be determined from its context.,His speech was made with such great ambiguity that neither supporter nor opponent could be certain of his true position.
ambiguous,Open to two or more interpretations; or of uncertain nature or significance; or (often) intended to mislead.,an equivocal statement
ambition,A cherished desire.,his ambition is to own his own business
ambitious,Having a strong desire for success or achievement.,an ambitious person
ambulance,A vehicle that takes people to and from hospitals.,
ammonia,A water solution of ammonia.,
among,Denotes a mingling or intermixing with distinct or separable objects. (See Usage Note at amidst.).,How can you speak with authority about their customs when you have never lived among them?
amongst,Denotes a mingling or intermixing with distinct or separable objects. See usage note at amidst.,"Janek feels very at ease amongst his friends, but gets incredibly nervous when meeting new people."
amount,A quantity of money.,he borrowed a large sum
ample,More than enough in size or scope or capacity.,had ample food for the party
amplifier,Electronic equipment that increases strength of signals passing through it.,
amplify,"Increase in size, volume or significance.",Her terror was magnified in her mind
amuse,"Occupy in an agreeable, entertaining or pleasant fashion.",The play amused the ladies
amused,"Occupy in an agreeable, entertaining or pleasant fashion.",The play amused the ladies
amusement,A feeling of delight at being entertained.,
amusing,"Occupy in an agreeable, entertaining or pleasant fashion.",The play amused the ladies
an,An associate degree in nursing.,
analogy,An inference that if things agree in some respects they probably agree in others.,
analysis,An investigation of the component parts of a whole and their relations in making up the whole.,
analyst,Someone who is skilled at analyzing data.,
analyze/analyse,Consider in detail and subject to an analysis in order to discover essential features or meaning.,analyze a sonnet by Shakespeare
ancestor,Someone from whom you are descended (but usually more remote than a grandparent).,This fossil animal is regarded as the ancestor of the horse.
anchor,A mechanical device that prevents a vessel from moving.,
anchorage,The condition of being secured to a base.,the plant needs a firm anchorage
anchorman,A television reporter who coordinates a broadcast to which several correspondents contribute.,
anchorperson,A television reporter who coordinates a broadcast to which several correspondents contribute.,
ancient,A very old person.,an ancient city  an ancient forest
and,"In rhythm, the second half of a divided beat.",
angel,Spiritual being attendant upon god.,"Thanks for making me breakfast in bed, you little angel."
anger,A strong emotion; a feeling that is oriented toward some real or supposed grievance.,You need to control your anger.
angle,The space between two lines or planes that intersect; the inclination of one line to another; measured in degrees or radians.,the angle between lines A and B
angrily,With anger.,he angrily denied the accusation
angry,Feeling or showing anger.,angry at the weather
anguish,Extreme mental distress.,
animal,A living organism characterized by voluntary movement.,"A cat is an animal, not a plant. Humans are also animals, under the scientific definition, as we are not plants."
animate,Heighten or intensify.,These paintings exalt the imagination
animated,Heighten or intensify.,These paintings exalt the imagination
animation,The condition of living or the state of being alive.,while there's life there's hope
ankle,A gliding joint between the distal ends of the tibia and fibula and the proximal end of the talus.,
anniversary,The date on which an event occurred in some previous year (or the celebration of it).,Today is the fiftieth anniversary of the end of the war.
announce,Make known; make an announcement.,She denoted her feelings clearly
announcement,A formal public statement.,the government made an announcement about changes in the drug war
annoy,"Cause annoyance in; disturb, especially by minor irritations.",Mosquitoes buzzing in my ear really bothers me
annoyance,The psychological state of being irritated or annoyed.,
annoyed,"Cause annoyance in; disturb, especially by minor irritations.",Mosquitoes buzzing in my ear really bothers me
annoying,The act of troubling or annoying someone.,"Marc loved his sister, but when she annoyed him he wanted to switch her off."
annual,(botany) a plant that completes its entire life cycle within the space of a year.,"I read the magazine, but I usually don't purchase the annuals."
annually,Without missing a year.,they travel to China annually
anonymous,Having no known name or identity or known source.,anonymous authors
another,Any of various alternatives; some other.,put it off to another (or some other) day
answer,A statement (either spoken or written) that is made to reply to a question or request or criticism or accusation.,I waited several days for his answer
ant,Social insect living in organized colonies; characteristically the males and fertile queen have wings during breeding season; wingless sterile females are the workers.,
anti,A person who is opposed (to an action or policy or practice etc.).,the antis smelled victory after a long battle
antiaircraft,Artillery designed to shoot upward at airplanes.,
